ÿÿÿÿSIB;sibling;The player of the role shares one or both parents in common with the scoping entity.
ÿÿÿÿÿÿBRO;brother;The player of the role is a male sharing one or both parents in common with the scoping entity.
ÿÿÿÿÿÿÿÿHBRO;half-brother;The player of the role is a male related to the scoping entity by sharing only one biological parent.
ÿÿÿÿÿÿÿÿNBRO;natural brother;The player of the role is a male having the same biological parents as the scoping entity.
ÿÿÿÿÿÿÿÿÿÿTWINBRO;twin brother;The scoper was carried in the same womb as the male player and shares common biological parents.
ÿÿÿÿÿÿÿÿÿÿÿÿFTWINBRO;fraternal twin brother;The scoper was carried in the same womb as the male player and shares common biological parents but is the product of a distinct egg/sperm pair.
ÿÿÿÿÿÿÿÿÿÿÿÿITWINBRO;identical twin brother;The male scoper is an offspring of the same egg-sperm pair as the male player.
ÿÿÿÿÿÿÿÿSTPBRO;stepbrother;The player of the role is a son of the scoping person's stepparent.
ÿÿÿÿÿÿHSIB;half-sibling;The player of the role is related to the scoping entity by sharing only one biological parent.
ÿÿÿÿÿÿÿÿHSIS;half-sister;The player of the role is a female related to the scoping entity by sharing only one biological parent.
ÿÿÿÿÿÿNSIB;natural sibling;The player of the role has both biological parents in common with the scoping entity.
ÿÿÿÿÿÿÿÿNSIS;natural sister;The player of the role is a female having the same biological parents as the scoping entity.
ÿÿÿÿÿÿÿÿÿÿTWINSIS;twin sister;The scoper was carried in the same womb as the female player and shares common biological parents.
ÿÿÿÿÿÿÿÿÿÿÿÿFTWINSIS;fraternal twin sister;The scoper was carried in the same womb as the female player and shares common biological parents but is the product of a distinct egg/sperm pair.
ÿÿÿÿÿÿÿÿÿÿÿÿITWINSIS;identical twin sister;The female scoper is an offspring of the same egg-sperm pair as the female player.
ÿÿÿÿÿÿÿÿTWIN;twin;The scoper and player were carried in the same womb and shared common biological parents.
ÿÿÿÿÿÿÿÿÿÿFTWIN;fraternal twin;The scoper and player were carried in the same womb and share common biological parents but are the product of distinct egg/sperm pairs.
ÿÿÿÿÿÿÿÿÿÿITWIN;identical twin;The scoper and player are offspring of the same egg-sperm pair.
ÿÿÿÿÿÿSIS;sister;The player of the role is a female sharing one or both parents in common with the scoping entity.
ÿÿÿÿÿÿÿÿSTPSIS;stepsister;The player of the role is a daughter of the scoping person's stepparent.
ÿÿÿÿÿÿSTPSIB;step sibling;The player of the role is a child of the scoping person's stepparent.
ÿÿÿÿSIGOTHR;significant other;"A person who is important to one's well being; especially a spouse or one in a similar relationship. (The player is the one who is important)"
ÿÿÿÿÿÿDOMPART;domestic partner;The player of the role cohabits with the scoping person but is not the scoping person's spouse.
ÿÿÿÿÿÿFMRSPS;former spouse;Player of the role was previously joined to the scoping person in marriage and this marriage is now dissolved and inactive.
;;Usage Note: This is significant to indicate as some jurisdictions have different legal requirements for former spouse to access the patient's record, from a general friend.
ÿÿÿÿÿÿSPS;spouse;The player of the role is a marriage partner of the scoping person.
ÿÿÿÿÿÿÿÿHUSB;husband;The player of the role is a man joined to a woman (scoping person) in marriage.
ÿÿÿÿÿÿÿÿWIFE;wife;The player of the role is a woman joined to a man (scoping person) in marriage.
ÿÿFRND;unrelated friend;The player of the role is a person who is known, liked, and trusted by the scoping person.
ÿÿNBOR;neighbor;The player of the role lives near or next to the scoping person.
ÿÿONESELF;self;The relationship that a person has with his or her self.
ÿÿROOM;Roommate;One who shares living quarters with the subject.
_PolicyOrProgramCoverageRoleType;PolicyOrProgramCoverageRoleType;Description: A role recognized through the eligibility of an identified party for benefits covered under an insurance policy or a program based on meeting eligibility criteria.
;;Eligibility as a covered party may be conditioned on the party meeting criteria to qualify for coverage under a policy or program, which may be mandated by law. These criteria may be:ÿ
;;The sole basis for coverage, e.g. being differently abled may qualify a person for disability coverage
;;May more fully qualify a covered party role e.g, being differently abled may qualify an adult child as a dependent
;;May impact the level of coverage for a covered party under a policy or program, e.g. being differently abled may qualify a program eligible for additional benefits.
;;"Discussion: The Abstract Value Set ""CoverageRoleType"", which was developed for use in the Canadian realm ""pre-coordinate"" coverage roles with other roles that a covered party must play in order to be eligible for coverage, e.g. ""handicapped dependent"". These role.codes may only be used with COVPTY to avoid overlapping concepts that would result from using them to specify the specializations of COVPTY, e.g. the role.class DEPEN should not be used with the role.code family dependent because that relationship has overlapping concepts due to the role.code precoodination and is conveyed in FICO with the personal relationship role that has a PART role link to the covered party role. For the same reasons, the role.class DEPEN should not be used with the role.code HANDIC (handicapped dependent); the role.code DIFFABLE (differently abled) should be used instead."
;;"In summary, the coded concepts in the Abstract Value Set ""CoveredPartyRoleType"" can be ""post-coordinated"" with the ""RoleClassCoveredParty"" Abstract Value Set. Decoupling these concepts is intended to support an expansive range of covered party concepts and their semantic comparability."
ÿÿ_CoverageRoleType;CoverageRoleType;Role recognized through the issuance of insurance coverage to an identified covered party who has this relationship with the policy holder such as the policy holder themselves (self), spouse, child, etc.
ÿÿÿÿFAMDEP;family dependent;The player of the role is dependent of the scoping entity.
ÿÿÿÿHANDIC;handicapped dependent;Covered party is a dependent of the policy holder with a physical or mental disability causing a disadvantage that makes independent achievement unusually difficult.
ÿÿÿÿINJ;injured plaintiff;Covered party is an injured party with a legal claim for compensation against a policy holder under an insurance policy.
ÿÿÿÿSELF;self;Covered party is the policy holder. Also known as the subscriber.
ÿÿÿÿSPON;sponsored dependent;Covered party is an individual that the policy holder has assumed responsibility for, such as foster child or legal ward.
ÿÿÿÿSTUD;student;Covered party to an insurance policy has coverage through full-time or part-time attendance at a recognized educational institution as defined by a particular insurance policy.
ÿÿÿÿÿÿFSTUD;full-time student;Covered party to an insurance policy has coverage through full-time attendance at a recognized educational institution as defined by a particular insurance policy.
ÿÿÿÿÿÿPSTUD;part-time student;Covered party to an insurance policy has coverage through part-time attendance at a recognized educational institution as defined by a particular insurance policy.
ÿÿÿÿADOPT;adopted child;A child taken into one's family through legal means and raised as one's own child.
ÿÿÿÿGCHILD;grandchild;A child of one's son or daughter.
ÿÿÿÿGPARNT;grandparent;parent of a parent of the subject.
ÿÿÿÿNAT;natural child;A child as determined by birth.
ÿÿÿÿNIENE;niece/nephew;A child of one's brother or sister or of the brother or sister of one's spouse.
ÿÿÿÿPARNT;parent;One that begets or brings forth offspring or a person who brings up and cares for another (Webster's Collegiate Dictionary)
ÿÿÿÿSPSE;spouse;"A marriage partner; a husband or wife."
ÿÿÿÿSTEP;step child;A child receiving parental care and nurture from a person who is related to them through marriage to their parent.
ÿÿ_CoveredPartyRoleType;covered party role type;A role recognized through the eligibility of an identified living subject for benefits covered under an insurance policy or a program. Eligibility as a covered party may be conditioned on a relationship with (1) the policy holder such as the policy holder who is covered as an individual under a poliy or as a party sponsored for coverage by the policy holder.
;;"Example:An employee as a subscriber; or (2) on being scoped another covered party such as the subscriber, as in the case of a dependent.ÿ"
;;"Discussion: The Abstract Value Set ""CoverageRoleType"", which was developed for use in the Canadian realm ""pre-coordinate"" coverage roles with other roles that a covered party must play in order to be eligible for coverage, e.g. ""handicapped dependent"". Other codes in the Abstract Value Set CoveredPartyRoleType domain can be ""post-coordinated"" with the EligiblePartyRoleType codes to denote comparable concepts. Decoupling the concepts is intended to support a wider range of concepts and semantic comparability of coded concepts."
ÿÿÿÿ_ClaimantCoveredPartyRoleType;ClaimantCoveredPartyRoleType;DescriptionA role recognized through the eligibility of a party play a claimant for benefits covered or provided under an insurance policy.
ÿÿÿÿÿÿCRIMEVIC;crime victim;Description: A person playing the role of program eligible under a program based on allegations of being the victim of a crime.
;;"Discussion: This CoveredPartyRoleType.code is typically used when the CoveredPartyRole class code is ""program eligible"" and the person's status as a crime victim meets jurisdictional or program criteria."
ÿÿÿÿÿÿINJWKR;injured worker;Description: A person playing the role of program eligible under a workers compensation program based on the filing of work-related injury claim.
;;"Discussion: This CoveredPartyRoleType.code is used when the CoveredPartyRole class code is either ""program eligible"", a ""named insured"", and ""individual insured"", or ""dependent"", and the person's status as differently abled or ""handicapped"" meets jurisdictional, policy, or program criteria."
ÿÿÿÿ_DependentCoveredPartyRoleType;DependentCoveredPartyRoleType;Description: A role recognized through the eligibility of a party to play a dependent for benefits covered or provided under a health insurance policy because of an association with the subscriber that is recognized by the policy underwriter.
ÿÿÿÿÿÿCOCBEN;continuity of coverage beneficiary;Description: A person playing the role of an individual insured with continuity of coverage under a policy which is being terminated based on loss of original status that was the basis for coverage. Criteria for qualifying for continuity of coverage may be set by law.
;;"Discussion: This CoveredPartyRoleType.code is typically used when the CoveredPartyRole class code is either ""program eligible"" or ""subscriber"" and the person's status as a continuity of coverage beneficiary meets jurisdictional or policy criteria."
ÿÿÿÿÿÿDIFFABL;differently abled;Description: A person playing the role of program eligible under a program based on meeting criteria for health or functional limitation set by law or by the program.
;;"Discussion: This CoveredPartyRoleType.code is typically used when the CoveredPartyRole class code is either ""program eligible"", ""named insured"", ""individual insured"", or ""dependent"", and the person's status as differently abled meets jurisdictional, policy, or program criteria."
ÿÿÿÿÿÿWARD;ward;Description: A person, who is a minor or is deemed incompetent, who plays the role of a program eligible where eligibility for coverage is based on meeting program eligibility criteria for status as a ward of a court or jurisdiction.
;;"Discussion: This CoveredPartyRoleType.code is typically used when the CoveredPartyRole class code is a ""claimant"", ""program eligible"", a ""named insured"", an ""individual Insured"" or a ""dependent"", and the person's status as a ward meets program or policy criteria. In the case of a ward covered under a program providing financial or health benefits, a governmental agency may take temporary custody of a minor or incompetent for his/her protection and care, e.g. if the ward is suffering from neglect or abuse, or has been in trouble with the law."
ÿÿÿÿ_IndividualInsuredPartyRoleType;IndividualInsuredPartyRoleType;A role recognized through the eligibility of a party to play an individual insured for benefits covered or provided under an insurance policy where the party is also the policy holder.
ÿÿÿÿÿÿRETIREE;retiree;Description: A person playing the role of an individual insured under a policy based on meeting criteria for the employment status of retired set by law or the policy.
;;"Discussion: This CoveredPartyRoleType.code is typically used when the CoveredPartyRole class code is either ""program eligible"" or ""subscriber"" and the person's status as a retiree meets jurisdictional or policy criteria."
ÿÿÿÿ_ProgramEligiblePartyRoleType;ProgramEligiblePartyRoleType;Description:A role recognized through the eligibility of a party to play a program eligible for benefits covered or provided under a program.
ÿÿÿÿÿÿINDIG;member of an indigenous people;Description: A person playing the role of program eligible under a program based on aboriginal ancestry or as a member of an aboriginal community.
;;"Discussion: This CoveredPartyRoleType.code is typically used when the CoveredPartyRole class code is ""program eligible"" and the person's status as a member of an indigenous people meets jurisdictional or program criteria."
ÿÿÿÿÿÿMIL;military;Definition: A person playing the role of program eligible under a program based on military status.
;;"Discussion: This CoveredPartyRoleType.code is typically used when the CoveredPartyRole class code is either ""program eligible"" or ""subscriber"" and the person's status as a member of the military meets jurisdictional or program criteria"
ÿÿÿÿÿÿÿÿACTMIL;active duty military;Description: A person playing the role of program eligible under a program based on active military status.
;;"Discussion: This CoveredPartyRoleType.code is typically used when the CoveredPartyRole class code is either ""program eligible"" or ""subscriber"" and the persons status as active duty military meets jurisdictional or program criteria."
ÿÿÿÿÿÿÿÿRETMIL;retired military;Description: A person playing the role of program eligible under a program based on retired military status.
;;"Discussion: This CoveredPartyRoleType.code is typically used when the CoveredPartyRole class code is either ""program eligible"" or ""subscriber"" and the persons status as retired military meets jurisdictional or program criteria."
ÿÿÿÿÿÿÿÿVET;veteran;Description: A person playing the role of program eligible under a program based on status as a military veteran.
;;"Discussion: This CoveredPartyRoleType.code is typically used when the CoveredPartyRole class code is either ""program eligible"" or ""subscriber"" and the persons status as a veteran meets jurisdictional or program criteria."
ÿÿÿÿ_SubscriberCoveredPartyRoleType;SubscriberCoveredPartyRoleType;Description: A role recognized through the eligibility of a party to play a subscriber for benefits covered or provided under a health insurance policy.
_ResearchSubjectRoleBasis;ResearchSubjectRoleBasis;"Specifies the administrative functionality within a formal experimental design for which the ResearchSubject role was established. Examples: screening - role is used for pre-enrollment evaluation portion of the design; enrolled - role is used for subjects admitted to the active treatment portion of the design."
ÿÿERL;enrollment;Definition:The specific role being played by a research subject participating in the active treatment or primary data collection portion of a research study.
ÿÿSCN;screening;Definition:The specific role being played by a research subject participating in the pre-enrollment evaluation portion of a research study.
_ServiceDeliveryLocationRoleType;ServiceDeliveryLocationRoleType;A role of a place that further classifies the setting (e.g. accident site, road side, work site, community location) in which services are delivered.
ÿÿ_DedicatedServiceDeliveryLocationRoleType;DedicatedServiceDeliveryLocationRoleType;A role of a place that further classifies a setting that is intended to house the provision of services.
ÿÿÿÿ_DedicatedClinicalLocationRoleType;DedicatedClinicalLocationRoleType;A role of a place that further classifies the clinical setting (e.g. cardiology clinic, primary care clinic, rehabilitation hospital, skilled nursing facility) in which care is delivered during an encounter.
ÿÿÿÿÿÿDX;Diagnostics or therapeutics unit;A practice setting where diagnostic procedures or therapeutic interventions are performed
ÿÿÿÿÿÿÿÿCVDX;Cardiovascular diagnostics or therapeutics unit;A practice setting where cardiovascular diagnostic procedures or therapeutic interventions are performed (e.g. cardiac catheterization lab, echocardiography suite)
ÿÿÿÿÿÿÿÿÿÿCATH;Cardiac catheterization lab;Cardiac catheterization lab
ÿÿÿÿÿÿÿÿÿÿECHO;Echocardiography lab;Echocardiography lab
ÿÿÿÿÿÿÿÿGIDX;Gastroenterology diagnostics or therapeutics lab;A practice setting where GI procedures (such as endoscopies) are performed
ÿÿÿÿÿÿÿÿÿÿENDOS;Endoscopy lab;(X12N 261QD0000N)
ÿÿÿÿÿÿÿÿRADDX;Radiology diagnostics or therapeutics unit;A practice setting where radiology services (diagnostic or therapeutic) are provided (X12N 261QR0200N)
ÿÿÿÿÿÿÿÿÿÿRADO;Radiation oncology unit;(X12N 261QX0203N)
ÿÿÿÿÿÿÿÿÿÿRNEU;Neuroradiology unit;Neuroradiology unit
ÿÿÿÿÿÿHOSP;Hospital;An acute care institution that provides medical, surgical, or psychiatric care and treatment for the sick or the injured.
ÿÿÿÿÿÿÿÿCHR;Chronic Care Facility;"(1) A hospital including a physical plant and personnel that provides multidisciplinary diagnosis and treatment for diseases that have one or more of the following characteristics: is permanent; leaves residual disability; is caused by nonreversible pathological alteration; requires special training of the patient for rehabilitation; and/or may be expected to require a long period of supervision or care. In addition, patients require the safety, security, and shelter of these specialized inpatient or partial hospitalization settings. (2) A hospital that provides medical and skilled nursing services to patients with long-term illnesses who are not in an acute phase but who require an intensity of services not available in nursing homes"
ÿÿÿÿÿÿÿÿGACH;"Hospitals; General Acute Care Hospital";(X12N 282N00000N)
ÿÿÿÿÿÿÿÿMHSP;Military Hospital;A health care facility operated by the Department of Defense or other military operation.
ÿÿÿÿÿÿÿÿPSYCHF;Psychatric Care Facility;Healthcare facility that cares for patients with psychiatric illness(s).
ÿÿÿÿÿÿÿÿRH;Rehabilitation hospital;(X12N 283X00000N)
ÿÿÿÿÿÿÿÿÿÿRHAT;addiction treatment center;Description: A location that plays the role of delivering services which may include life training and/or social support to people with addictions.
ÿÿÿÿÿÿÿÿÿÿRHII;intellectual impairment center;Description: A location that plays the role of delivering services which may include adaptation, rehabilitation and social integration services for people with intellectual and/or pervasive development disorders such as autism or severe behavior disorder.
ÿÿÿÿÿÿÿÿÿÿRHMAD;parents with adjustment difficulties center;Description: A location that plays the role of delivering services which may social support services for adolescents who are pregnant or have child and are experiencing adaptation issues/difficulties in their current or eventual parenting role.
ÿÿÿÿÿÿÿÿÿÿRHPI;physical impairment center;Description: A location that plays the role of delivering services which may include adaptation, rehabilitation and social integration services for people with physical impairments.
ÿÿÿÿÿÿÿÿÿÿÿÿRHPIH;physical impairment - hearing center;Description: A location that plays the role of delivering services for people with hearing impairments.
ÿÿÿÿÿÿÿÿÿÿÿÿRHPIMS;physical impairment - motor skills center;Description: A location that plays the role of delivering services for people with motor skill impairments.
ÿÿÿÿÿÿÿÿÿÿÿÿRHPIVS;physical impairment - visual skills center;Description: A location that plays the role of delivering services for people with visual skill impairments.
ÿÿÿÿÿÿÿÿÿÿRHYAD;youths with adjustment difficulties center;Description: A location that plays the role of delivering services which may include life training and/or social support services for the adaption, rehabilitation and social integration of youths with adjustment difficulties.
ÿÿÿÿÿÿHU;Hospital unit;Hospital unit
ÿÿÿÿÿÿÿÿBMTU;Bone marrow transplant unit;Bone marrow transplant unit
ÿÿÿÿÿÿÿÿCCU;Coronary care unit;Coronary care unit
ÿÿÿÿÿÿÿÿCHEST;Chest unit;A specialty unit in hospital that focuses on chronic respirator patients and pulmonary failure
ÿÿÿÿÿÿÿÿEPIL;Epilepsy unit;Epilepsy unit
ÿÿÿÿÿÿÿÿER;Emergency room;The section of a health care facility for providing rapid treatment to victims of sudden illness or trauma.
ÿÿÿÿÿÿÿÿÿÿETU;Emergency trauma unit;Emergency trauma unit
ÿÿÿÿÿÿÿÿHD;Hemodialysis unit;Hemodialysis unit
ÿÿÿÿÿÿÿÿHLAB;hospital laboratory;Description: A location that plays the role of delivering services which may include tests done based on clinical specimens to get health information about a patient as pertaining to the diagnosis, treatment and prevention of disease. Hospital laboratories may be further divided into specialized units such as Anatomic Pathology, Microbiology, and Biochemistry.
ÿÿÿÿÿÿÿÿÿÿINLAB;inpatient laboratory;Description: A location that plays the role of delivering services which may include tests are done on clinical specimens to get health information about a patient pertaining to the diagnosis, treatment, and prevention of disease for a hospital visit longer than one day.
ÿÿÿÿÿÿÿÿÿÿOUTLAB;outpatient laboratory;Description: A location that plays the role of delivering services which may include tests are done on clinical specimens to get health information about a patient pertaining to the diagnosis, treatment, and prevention of disease for same day visits.
ÿÿÿÿÿÿÿÿHRAD;radiology unit;Description: A location that plays the role of delivering services which may include the branch of medicine that uses ionizing and non-ionizing radiation to diagnose and treat diseases. The radiology unit may be further divided into subspecialties such as Imaging, Cardiovascular, Thoracic, and Ultrasound.
ÿÿÿÿÿÿÿÿHUSCS;specimen collection site;Description: A location that plays the role of delivering services which may include collecting specimens and/or samples from patients for laboratory testing purposes, but does not perform any tests or analysis functions.
ÿÿÿÿÿÿÿÿICU;Intensive care unit;Intensive care unit
ÿÿÿÿÿÿÿÿÿÿPEDICU;Pediatric intensive care unit;Pediatric intensive care unit
ÿÿÿÿÿÿÿÿÿÿÿÿPEDNICU;Pediatric neonatal intensive care unit;Pediatric neonatal intensive care unit
ÿÿÿÿÿÿÿÿINPHARM;inpatient pharmacy;Description: A location that plays the role of delivering services which may include providing judicious, safe, efficacious, appropriate and cost effective use of medicines for treatment of patients for visits longer than one day. The distinction between inpatient pharmacies and retail (or outpatient) pharmacies is that they are part of a patient's continuity of care while staying in the hospital.
ÿÿÿÿÿÿÿÿMBL;medical laboratory;Description: A location that plays the role of delivering services which include biochemistry, hematology, microbiology, immunochemistry, and toxicology.
ÿÿÿÿÿÿÿÿNCCS;Neurology critical care and stroke unit;Neurology critical care and stroke unit
ÿÿÿÿÿÿÿÿNS;Neurosurgery unit;Neurosurgery unit
ÿÿÿÿÿÿÿÿOUTPHARM;outpatient pharmacy;Description: A location that plays the role of delivering services which may include providing judicious, safe, efficacious, appropriate and cost effective use of medicines for treatment of patients for outpatient visits and may also be used for discharge prescriptions.
ÿÿÿÿÿÿÿÿPEDU;Pediatric unit;Pediatric unit
ÿÿÿÿÿÿÿÿPHU;Psychiatric hospital unit;(X12N 273R00000N)
ÿÿÿÿÿÿÿÿRHU;Rehabilitation hospital unit;Rehabilitation hospital unit
ÿÿÿÿÿÿÿÿSLEEP;Sleep disorders unit;(X12N 261QA1200N)
ÿÿÿÿÿÿNCCF;Nursing or custodial care facility;Nursing or custodial care facility
ÿÿÿÿÿÿÿÿSNF;Skilled nursing facility;(X12N 314000000N)
ÿÿÿÿÿÿOF;Outpatient facility;Outpatient facility
ÿÿÿÿÿÿÿÿALL;Allergy clinic;Allergy clinic
ÿÿÿÿÿÿÿÿAMPUT;Amputee clinic;Amputee clinic
ÿÿÿÿÿÿÿÿBMTC;Bone marrow transplant clinic;Bone marrow transplant clinic
ÿÿÿÿÿÿÿÿBREAST;Breast clinic;Breast clinic
ÿÿÿÿÿÿÿÿCANC;Child and adolescent neurology clinic;Child and adolescent neurology clinic
